{
  "schemaVersion": "v1alpha1",
  "runId": "20260614193127",
  "workflow": "policy-blocked",
  "adapter": "mock",
  "status": "approval_required",
  "startedAt": "2026-06-14T19:31:27.140Z",
  "completedAt": "2026-06-14T19:31:27.144Z",
  "stages": [
    {
      "id": "destructive-command",
      "status": "blocked",
      "artifacts": [
        ".vibeharness/runs/latest/approval-request.json"
      ]
    }
  ],
  "policyDecisions": [
    {
      "id": "destructive-command",
      "runId": "20260614193127",
      "stageId": "destructive-command",
      "actionType": "command",
      "resource": "rm -rf build",
      "decision": "approval_required",
      "reason": "Destructive shell commands require explicit policy handling.",
      "policyRuleId": "commands.destructive",
      "timestamp": "2026-06-14T19:31:27.140Z",
      "artifactReferences": [
        ".vibeharness/runs/<run_id>/policy-decisions/destructive-command.json"
      ],
      "requestedApprovalActor": "human",
      "command": "rm -rf build"
    }
  ],
  "tests": [
    {
      "command": "mock fixture assertions",
      "status": "passed"
    }
  ],
  "artifacts": [
    ".vibeharness/runs/<run_id>/adapter-task.yaml",
    ".vibeharness/runs/<run_id>/stage-logs/implementation.log",
    ".vibeharness/runs/<run_id>/policy-decisions/destructive-command.json"
  ]
}
