{
  "schemaVersion": "v1alpha1",
  "runId": "20260614003747",
  "workflow": "policy-blocked",
  "adapter": "mock",
  "status": "approval_required",
  "startedAt": "2026-06-14T00:37:47.626Z",
  "completedAt": "2026-06-14T00:37:47.629Z",
  "stages": [
    {
      "id": "destructive-command",
      "status": "blocked",
      "artifacts": [
        ".vibeharness/runs/latest/approval-request.json"
      ]
    }
  ],
  "policyDecisions": [
    {
      "id": "destructive-command",
      "decision": "approval_required",
      "reason": "Mock fixture requested a destructive command.",
      "command": "rm -rf build"
    }
  ],
  "tests": [
    {
      "command": "mock fixture assertions",
      "status": "passed"
    }
  ],
  "artifacts": [
    ".vibeharness/runs/<run_id>/adapter-task.yaml",
    ".vibeharness/runs/<run_id>/stage-logs/implementation.log",
    ".vibeharness/runs/<run_id>/policy-decisions/destructive-command.json"
  ]
}
