{
  "schemaVersion": "v1alpha1",
  "runId": "20260614194407",
  "workflow": "policy-denied",
  "adapter": "mock",
  "status": "failed",
  "startedAt": "2026-06-14T19:44:07.095Z",
  "completedAt": "2026-06-14T19:44:07.098Z",
  "stages": [
    {
      "id": "secret-read",
      "status": "failed",
      "artifacts": [
        ".vibeharness/runs/latest/policy-decisions/secret-read.json"
      ]
    }
  ],
  "policyDecisions": [
    {
      "id": "secret-read",
      "runId": "20260614194407",
      "stageId": "secret-read",
      "actionType": "secret",
      "resource": ".env",
      "decision": "deny",
      "reason": "Secret access follows the policy default.",
      "policyRuleId": "secrets.default",
      "timestamp": "2026-06-14T19:44:07.095Z",
      "artifactReferences": [
        ".vibeharness/runs/<run_id>/policy-decisions/secret-read.json"
      ]
    }
  ],
  "tests": [
    {
      "command": "mock fixture assertions",
      "status": "failed"
    }
  ],
  "artifacts": [
    ".vibeharness/runs/<run_id>/adapter-task.yaml",
    ".vibeharness/runs/<run_id>/stage-logs/implementation.log",
    ".vibeharness/runs/<run_id>/policy-decisions/secret-read.json"
  ]
}
